[
  {
    "policy_id": "mp-sev1-platform",
    "version": "1.0.0",
    "status": "active",
    "effective_from": "2026-02-14T00:00:00.000Z"
  },
  {
    "policy_id": "mp-sev2-platform",
    "version": "1.0.0",
    "status": "active",
    "effective_from": "2026-02-14T00:00:00.000Z"
  },
  {
    "policy_id": "mp-sev3-platform",
    "version": "1.0.0",
    "status": "active",
    "effective_from": "2026-02-14T00:00:00.000Z"
  }
]
